{
  "metadata": {
    "scraped_at": "2026-01-25T22:14:56.677607",
    "source_url": "https://www.nordkeyboards.com/products/nord-stage-4/",
    "brand": "Nord",
    "model": "Nord Stage 4"
  },
  "raw_payload": {
    "source_url": "https://www.nordkeyboards.com/products/nord-stage-4/",
    "brand": "Nord",
    "model": "Nord Stage 4",
    "name": "Nord Stage 4",
    "description": "Products\nAccessories\nSounds\nSoftware\nDownloads\nArtists\nAbout us\nNews\nSupport\nDistributors\nALL PRODUCTS\nNord Electro 7\nNord Stage 4\nNord Piano 6\nNord Organ 3\nNord Grand 2\nNord Electro 6\nNord Wave 2\nNord Lead A1\nNord Drum 3P\nLegacy products\nCompare Products\nNord Stage 4\n\nThe latest generation of our iconic flagship series – the Nord Stage 4 features a new intuitive panel design, a premium triple sensor keybed, and complete effect sections for each layer. With significant enhancements to our award-winning technologies - the Stage 4 sets a new standard for live performance stage keyboards.\n\nModels\n\nNord Stage 4 88\nNord Stage 4 73\nNord Stage 4 Compact\n\n88-key weighted triple sensor keybed with aftertouch and physical drawbars with LED\n\nOverview\nSpecifications\nSounds\nDownloads\nImages & videos\nAccessories\nHighlight features\n\nPerformance/General\n\nNew panel design for exceptional overview and flexibility\nPremium Triple sensor keybed\nNew preset library\nDedicated LED faders for each Layer\n\nSynth section\n\nNord Wave 2 Synth Engine\n3 independent Synth Layers\nDoubled sample memory\nEnhanced samples with Tru-Vibrato, Unison and Round Robin\nExtensive real time controls\nAdvanced Arpeggiator with Polyphonic, Gate and Pattern modes\nExtern mode for advanced MIDI control\n\nPiano section\n\nEnhanced collection of Uprights, Grands,EPs and more\nDynamic Compression\nUnison feature\nCreative Timbre presets\nAdvanced String Resonance\nDynamic Pedal Noise\n\nEffects\n\nDedicated Effect section per Layer\nNew Variations for Modulation, Amp, Delay and Reverb Effects\nNew Spring, Booth and Cathedral Reverb\nNew Spin effect\nNew Pump effect\nNew Flam and Space Delay\n\nOrgan section\n\nAward-winning organ simulations of B3, Vox/Farfisa and Pipe Organ models\nPhysical drawbars with LED indicators\nEnhanced Rotary Speaker Drive\nDrawbar Live mode\nNew B3 Bass mode\nEnhanced model 122 Vintage Rotary Speaker with new drive including close or distant mic position\n\n\n\n\nThe new experience\n\nThe Nord Stage 4 features a brand new panel design with dedicated LED faders for each Layer, providing exceptional overview and flexibility when creating sounds and performing live. The new Preset Library is packed with inspiring ready-to-use Piano, Synth and Organ sounds for quick and smooth patch creation.\n\nThe Layer Scene lets you seamlessly switch between two different sound setups at the touch of a button. Adding a powerful new Effect section coupled with versatile pedal options and a premium Triple Sensor keybed, the Nord Stage 4 offers a new level of musical expression.\n\nNew panel design for exceptional overview and flexibility\nPremium Triple sensor keybed\nNew preset library\nDedicated LED faders for each Layer\n\nPiano Section\n\nThe Nord Stage 4 comes with a new enhanced collection of Grands, Uprights and Electric Pianos from our exclusive Nord Piano Library combined with new features such as Dynamic compression and Unison.\n\nNord’s state-of-the-art sampling techniques capture the extraordinary nuances and real character of the source instruments. Our unique ‘Advanced String Resonance’ and Dynamic Pedal Noise features deliver breathtaking realism and an unsurpassed level of expressiveness.\n\nEnhanced collection of Uprights, Grands,EPs and more\nDynamic Compression\nUnison feature\nCreative Timbre presets\nAdvanced String Resonance\nDynamic Pedal Noise\n\nSynth Section\n\nThe Synth section with its three independent Layers is based on the powerful Nord Wave 2 Synth Engine, including Virtual Analog synthesis, Samples, FM and Wavetable.\n\nAn extensive new collection of samples from the Nord Sample Library offers a broad sonic palette of Strings, Bass, Choirs, Guitars and much more. The advanced Arpeggiator features new Polyphonic, Gate and Pattern modes and can be used for a huge variety of rhythmic applications with customizable patterns.\n\nNord Wave 2 Synth Engine\n3 independent Synth Layers\nDoubled sample memory\nEnhanced samples with Tru-Vibrato, Unison and Round Robin\nExtensive real time controls\nAdvanced Arpeggiator with Polyphonic, Gate and Pattern modes\nExtern mode for advanced MIDI control\n\nOrgan Section\n\nThe Organ section features our award-winning simulations of B3 Tonewheel, B3 Bass, classic Vox and Farfisa as well as two Pipe Organ models. All Stage 4 models are equipped with our new Physical drawbars with LED indicators for optimal hands-on experience and overview.\n\nAward-winning organ simulations of B3, Vox/Farfisa and Pipe Organ models\nPhysical drawbars with LED indicators\nEnhanced Rotary Speaker Drive\nDrawbar Live mode\nNew B3 Bass mode\nEnhanced model 122 Vintage Rotary Speaker with new drive including close or distant mic position\n\nEffect Section\n\nThe Nord Stage 4 has a powerful new Effect section offering a complete setup of Effects for each Layer. The extensive range of Effects includes a new Pump effect for side chain simulation, a new Spin effect and brand new variations of Reverb, Delay, Amps and Modulation effects.\n\nDedicated Effect section per Layer\nNew Variations for Modulation, Amp, Delay and Reverb Effects\nNew Spring, Booth and Cathedral Reverb\nNew Spin effect\nNew Pump effect\nNew Flam and Space Delay\n\nProducts\nSounds\nDownloads\nSoftware\nArtists\nAbout Us\nDistributors\nSupport\nNews\nNewsletter\nYouTube\nInstagram\nTwitter\nFacebook\nCookie settings\n\nCopyright © 2025 Clavia DMI AB. All rights reserved.\n\n×\nThis website uses cookies\nThis website uses cookies to improve user experience. By using our website you consent to all cookies in accordance with our Cookie Policy.\nRead more\nStrictly necessary\nPerformance\nTargeting\nUnclassified\nShow details\nAccept all\nDecline all\nCookie declaration\nAbout cookies\nStrictly necessary\nPerformance\nTargeting\nUnclassified\nStrictly necessary cookies allow core website functionality such as user login and account management. The website cannot be used properly without strictly necessary cookies.\nName\tProvider / Domain\tExpiration\tDescription\ncsrftoken\twww.nordkeyboards.com\t1 month\tThis cookie is associated with the Django web development platform for Python. It is designed to protect a website against a certain type of software attack on web forms.\nproductTooltip\twww.nordkeyboards.com\t7 days\tThis cookie remembers whether the user has closed the tooltip that describes the product chooser.\nCookieScriptConsent\t\nCookieScript\nwww.nordkeyboards.com\t1 month\tThis cookie is used by Cookie-Script.com service to remember visitor cookie consent preferences. It is necessary for Cookie-Script.com cookie banner to work properly.\nVISITOR_PRIVACY_METADATA\t\nYouTube\n.youtube.com\t6 months\tThis cookie is used to store the user's consent and privacy choices for their interaction with the site. It records data on the visitor's consent regarding various privacy policies and settings, ensuring that their preferences are honored in future sessions.\n__cflb\t\nCloudflare, Inc.\napi2.hcaptcha.com\t30 minutes\tThis cookie is used for load balancing and for identifying trusted web traffic. It helps in ensuring consistent service and user experience by managing traffic and routing users to specific servers.\nPerformance cookies are used to see how visitors use the website, eg. analytics cookies. Those cookies cannot be used to directly identify a certain visitor.\nName\tProvider / Domain\tExpiration\tDescription\n_ga_GL2X1VT0CK\t.nordkeyboards.com\t1 year\tThis cookie is used by Google Analytics to persist session state.\n_ga\t\nGoogle LLC\n.nordkeyboards.com\t1 year 1 month\tThis cookie name is associated with Google Universal Analytics - which is a significant update to Google's more commonly used analytics service. This cookie is used to distinguish unique users by assigning a randomly generated number as a client identifier. It is included in each page request in a site and used to calculate visitor, session and campaign data for the sites analytics reports.\n_ga_S8Z6NRNNEV\t.nordkeyboards.com\t1 year 1 month\tThis cookie is used by Google Analytics to persist session state.\nTargeting cookies are used to identify visitors between different websites, eg. content partners, banner networks. Those cookies may be used by companies to build a profile of visitor interests or show relevant ads on other websites.\nName\tProvider / Domain\tExpiration\tDescription\nVISITOR_INFO1_LIVE\t\nGoogle LLC\n.youtube.com\t6 months\tThis cookie is set by Youtube to keep track of user preferences for Youtube videos embedded in sites;it can also determine whether the website visitor is using the new or old version of the Youtube interface.\nYSC\t\nGoogle LLC\n.youtube.com\tSession\tThis cookie is set by YouTube to track views of embedded videos.\nUnclassified cookies are cookies that do not belong to any other category or are in the process of categorization.\nName\tProvider / Domain\tExpiration\tDescription\n__Secure-ROLLOUT_TOKEN\t.youtube.com\t6 months\t\nCookies are small text files that are placed on your computer by websites that you visit. Websites use cookies to help users navigate efficiently and perform certain functions. Cookies that are required for the website to operate properly are allowed to be set without your permission. All other cookies need to be approved before they can be set in the browser.\n\nYou can change your consent to cookie usage at any time on our Privacy Policy page.\nCookie report created by CookieScript",
    "specifications": [
      {
        "key": "Name",
        "value": "Provider / Domain"
      },
      {
        "key": "csrftoken",
        "value": "www.nordkeyboards.com"
      },
      {
        "key": "productTooltip",
        "value": "www.nordkeyboards.com"
      },
      {
        "key": "CookieScriptConsent",
        "value": "CookieScript\nwww.nordkeyboards.com"
      },
      {
        "key": "VISITOR_PRIVACY_METADATA",
        "value": "YouTube\n.youtube.com"
      },
      {
        "key": "__cflb",
        "value": "Cloudflare, Inc.\napi2.hcaptcha.com"
      },
      {
        "key": "Name",
        "value": "Provider / Domain"
      },
      {
        "key": "_ga_GL2X1VT0CK",
        "value": ".nordkeyboards.com"
      },
      {
        "key": "_ga",
        "value": "Google LLC\n.nordkeyboards.com"
      },
      {
        "key": "_ga_S8Z6NRNNEV",
        "value": ".nordkeyboards.com"
      },
      {
        "key": "Name",
        "value": "Provider / Domain"
      },
      {
        "key": "VISITOR_INFO1_LIVE",
        "value": "Google LLC\n.youtube.com"
      },
      {
        "key": "YSC",
        "value": "Google LLC\n.youtube.com"
      },
      {
        "key": "Name",
        "value": "Provider / Domain"
      },
      {
        "key": "__Secure-ROLLOUT_TOKEN",
        "value": ".youtube.com"
      }
    ],
    "images": [
      {
        "url": "https://assets.nordkeyboards.com/nord-assets-prod/media/documents/Stage4_logo.svg",
        "alt_text": ""
      },
      {
        "url": "https://www.nordkeyboards.com/_next/image/?url=https%3A%2F%2Fassets.nordkeyboards.com%2Fnord-assets-prod%2Fmedia%2Foriginal_images%2FlyDePXcG%2FNS4_HA88_TopDown-01_241008.jpg&w=1920&q=75",
        "alt_text": "Nord Stage 4 88"
      },
      {
        "url": "https://assets.nordkeyboards.com/nord-assets-prod/media/images/QGeXFM5V/NS4_TecAwards.width-500.jpg",
        "alt_text": "NS4_TecAwards"
      },
      {
        "url": "https://assets.nordkeyboards.com/nord-assets-prod/media/images/Jl7f4ELM/NS4-Panel-piano.width-800.jpg",
        "alt_text": "Nord Stage 4 piano panel"
      },
      {
        "url": "https://assets.nordkeyboards.com/nord-assets-prod/media/images/45uiE0kc/NS4-Panel-synth.width-800.jpg",
        "alt_text": "Nord Stage 4 synth panel"
      },
      {
        "url": "https://assets.nordkeyboards.com/nord-assets-prod/media/images/2UvfOZaA/NS4-Panel-organ.width-800.jpg",
        "alt_text": "Nord Stage 4 organ panel"
      },
      {
        "url": "https://assets.nordkeyboards.com/nord-assets-prod/media/images/L0rPACoR/NS4-Panel-effects.width-800.jpg",
        "alt_text": "Nord Stage 4 effects panel"
      }
    ],
    "videos": [
      "https://www.youtube.com/embed/nJ6SsRPLCfo?feature=oembed"
    ],
    "features": [
      "Accessories",
      "Distributors",
      "Nord Electro 7",
      "Nord Stage 4",
      "Nord Piano 6",
      "Nord Organ 3",
      "Nord Grand 2",
      "Nord Electro 6",
      "Nord Wave 2",
      "Nord Lead A1",
      "Nord Drum 3P",
      "Legacy products",
      "Compare Products",
      "ProductsMinusAll ProductsNord Electro 7Nord Stage 4Nord Piano 6Nord Organ 3Nord Grand 2Nord Electro 6Nord Wave 2Nord Lead A1Nord Drum 3PLegacy productsCompare Products",
      "All Products",
      "Nord Electro 7",
      "Nord Stage 4",
      "Nord Piano 6",
      "Nord Organ 3",
      "Nord Grand 2",
      "Nord Electro 6",
      "Nord Wave 2"
    ],
    "manuals": [],
    "support_url": "https://www.nordkeyboards.com/products/nord-stage-4/",
    "hierarchy": {},
    "metadata": {
      "raw_capture": true
    }
  }
}