{
  "metadata": {
    "scraped_at": "2026-01-25T22:14:56.678082",
    "source_url": "https://www.nordkeyboards.com/products/nord-piano-6/",
    "brand": "Nord",
    "model": "Nord Piano 6"
  },
  "raw_payload": {
    "source_url": "https://www.nordkeyboards.com/products/nord-piano-6/",
    "brand": "Nord",
    "model": "Nord Piano 6",
    "name": "Nord Piano 6",
    "description": "Products\nAccessories\nSounds\nSoftware\nDownloads\nArtists\nAbout us\nNews\nSupport\nDistributors\nALL PRODUCTS\nNord Electro 7\nNord Stage 4\nNord Piano 6\nNord Organ 3\nNord Grand 2\nNord Electro 6\nNord Wave 2\nNord Lead A1\nNord Drum 3P\nLegacy products\nCompare Products\nNord Piano 6\n\nThe latest generation of the Nord Piano series features a new panel design with LED faders, dual layers for Piano and Synth with independent effects and a premium Triple Sensor keybed. Combined with excellent portability and our world-class sounds, the Nord Piano 6 offers great flexibility for performance and sound creation.\n\nModels\n\nNord Piano 6 88\nNord Piano 6 73\n\n88-key Triple Sensor Hammer Action Keybed\n\nOverview\nSpecifications\nSounds\nDownloads\nImages & videos\nAccessories\nHighlight features\n\nGeneral\n\n2 Piano + 2 Sample Synth Layers for advanced splits and layering\nDedicated LED faders for each Layer\nPremium Triple sensor keybed\nNord Triple Pedal 2 included\n\nEffects\n\nDedicated Effects section per Layer\nModulation Effects with Rate and Amount\nGlobal Reverb with Send per Layer, Pre-Delay, Chorale and Bright/Dark mode\nNew Spring reverb\nNew Spin effect\nDelay with new Filter, Flam and Ping Pong options\nDedicated Compressor effect\n\nPiano Section\n\n2 independent Piano Layers\n120 Voice Polyphony\nSoft, Mid, Bright and Dyno filters\nDynamic Compression\nUnison feature\n3 Keyboard Touch options\nAdvanced String Resonance\n\nSample Synth\n\n2 independent Sample Synth Layers\nUnison for rich, ensemble-like sounds\nTru-Vibrato with real time control\nRound robin for natural sounding repetitions\nMono and Legato modes with Glide\nAttack, Decay/Sustain, Release and Dynamic controls\n\nPerformance\n\nThe Nord Piano 6 has a new panel design with dedicated LED faders for Piano and Synth sections as well as knobs and buttons for all essential features, offering great flexibility when performing and designing sounds. The dual Piano and Synth engines can be layered together or split across the keyboard, with each layer featuring its own dedicated Effects section.\n\nDual Piano Layers\nDual Synth Layers\nSplit Point with 9 locations and optional Crossfade\nSeamless Transitions\n6 Live programs\nProgram Up/Down and Vibrato options for Nord Triple Pedal 2\n\nPiano Section\n\nThe Nord Piano 6 contains a large selection of Grands, Uprights and Electric Pianos from our exclusive Nord Piano Library along with new features such as Dynamic Compression and Unison. Our state-of-the-art sampling technique captures the extraordinary nuances and real character of the source instruments.\n\nThe new included Nord Triple Pedal 2 enables our unique ‘Advanced String Resonance’ and Dynamic Pedal Noise features, delivering stunning realism and expressiveness.\n\nExtensive collection of Grands, Uprights, EPs and more\nDynamic Compression\nUnison feature\nCreative Timbre options\nAdvanced String Resonance\nDynamic Pedal Noise\n\nSample Synth Section\n\nThe Sample Synth features two independent layers and comes with a broad collection of new and updated sounds, ranging from strings, wind, brass, basses and guitars to classic analog leads and basses. The factory bank includes exclusive high-end samples from the acclaimed Spitfire, Symphobia and Swing libraries. The Sample Synth section provides two fully-featured and independent Layers equipped with intuitive controls for attack, decay/sustain, release and dynamic velocity response.\n\nAdditional Sample Synth features include Unison, which blends multiple sample voices for rich, ensemble-like sounds and “Tru-Vibrato”, capturing the unique vibrato characteristics of various acoustic instruments. The advanced Round-Robin feature allows for a natural sound when repeating notes.\n\n2 independent Synth Layers\nEnhanced samples with Tru-Vibrato, Unison and Round Robin\n\nEffect Section\n\nThe Nord Piano 6 has an expanded new Effects section per Layer. The wide range of Effects includes brand new types of Reverb, Delay, Amps and Modulation effects.\n\nDedicated Effects section per Layer\nModulation Effects with Rate and Amount\nGlobal Reverb with Send per Layer, Pre-Delay, Chorale and Bright/Dark mode\nNew Spring reverb\nNew Spin effect\nDelay with new Filter, Flam and Ping-Pong\nDedicated Compressor effect\nAmp with new Tone variations\n\nProducts\nSounds\nDownloads\nSoftware\nArtists\nAbout Us\nDistributors\nSupport\nNews\nNewsletter\nYouTube\nInstagram\nTwitter\nFacebook\nCookie settings\n\nCopyright © 2025 Clavia DMI AB. All rights reserved.\n\n×\nThis website uses cookies\nThis website uses cookies to improve user experience. By using our website you consent to all cookies in accordance with our Cookie Policy.\nRead more\nStrictly necessary\nPerformance\nTargeting\nUnclassified\nShow details\nAccept all\nDecline all\nCookie declaration\nAbout cookies\nStrictly necessary\nPerformance\nTargeting\nUnclassified\nStrictly necessary cookies allow core website functionality such as user login and account management. The website cannot be used properly without strictly necessary cookies.\nName\tProvider / Domain\tExpiration\tDescription\ncsrftoken\twww.nordkeyboards.com\t1 month\tThis cookie is associated with the Django web development platform for Python. It is designed to protect a website against a certain type of software attack on web forms.\nproductTooltip\twww.nordkeyboards.com\t7 days\tThis cookie remembers whether the user has closed the tooltip that describes the product chooser.\nCookieScriptConsent\t\nCookieScript\nwww.nordkeyboards.com\t1 month\tThis cookie is used by Cookie-Script.com service to remember visitor cookie consent preferences. It is necessary for Cookie-Script.com cookie banner to work properly.\nVISITOR_PRIVACY_METADATA\t\nYouTube\n.youtube.com\t6 months\tThis cookie is used to store the user's consent and privacy choices for their interaction with the site. It records data on the visitor's consent regarding various privacy policies and settings, ensuring that their preferences are honored in future sessions.\n__cflb\t\nCloudflare, Inc.\napi2.hcaptcha.com\t30 minutes\tThis cookie is used for load balancing and for identifying trusted web traffic. It helps in ensuring consistent service and user experience by managing traffic and routing users to specific servers.\nPerformance cookies are used to see how visitors use the website, eg. analytics cookies. Those cookies cannot be used to directly identify a certain visitor.\nName\tProvider / Domain\tExpiration\tDescription\n_ga_GL2X1VT0CK\t.nordkeyboards.com\t1 year\tThis cookie is used by Google Analytics to persist session state.\n_ga\t\nGoogle LLC\n.nordkeyboards.com\t1 year 1 month\tThis cookie name is associated with Google Universal Analytics - which is a significant update to Google's more commonly used analytics service. This cookie is used to distinguish unique users by assigning a randomly generated number as a client identifier. It is included in each page request in a site and used to calculate visitor, session and campaign data for the sites analytics reports.\n_ga_S8Z6NRNNEV\t.nordkeyboards.com\t1 year 1 month\tThis cookie is used by Google Analytics to persist session state.\nTargeting cookies are used to identify visitors between different websites, eg. content partners, banner networks. Those cookies may be used by companies to build a profile of visitor interests or show relevant ads on other websites.\nName\tProvider / Domain\tExpiration\tDescription\nVISITOR_INFO1_LIVE\t\nGoogle LLC\n.youtube.com\t6 months\tThis cookie is set by Youtube to keep track of user preferences for Youtube videos embedded in sites;it can also determine whether the website visitor is using the new or old version of the Youtube interface.\nYSC\t\nGoogle LLC\n.youtube.com\tSession\tThis cookie is set by YouTube to track views of embedded videos.\nUnclassified cookies are cookies that do not belong to any other category or are in the process of categorization.\nName\tProvider / Domain\tExpiration\tDescription\n__Secure-ROLLOUT_TOKEN\t.youtube.com\t6 months\t\nCookies are small text files that are placed on your computer by websites that you visit. Websites use cookies to help users navigate efficiently and perform certain functions. Cookies that are required for the website to operate properly are allowed to be set without your permission. All other cookies need to be approved before they can be set in the browser.\n\nYou can change your consent to cookie usage at any time on our Privacy Policy page.\nCookie report created by CookieScript",
    "specifications": [
      {
        "key": "Name",
        "value": "Provider / Domain"
      },
      {
        "key": "csrftoken",
        "value": "www.nordkeyboards.com"
      },
      {
        "key": "productTooltip",
        "value": "www.nordkeyboards.com"
      },
      {
        "key": "CookieScriptConsent",
        "value": "CookieScript\nwww.nordkeyboards.com"
      },
      {
        "key": "VISITOR_PRIVACY_METADATA",
        "value": "YouTube\n.youtube.com"
      },
      {
        "key": "__cflb",
        "value": "Cloudflare, Inc.\napi2.hcaptcha.com"
      },
      {
        "key": "Name",
        "value": "Provider / Domain"
      },
      {
        "key": "_ga_GL2X1VT0CK",
        "value": ".nordkeyboards.com"
      },
      {
        "key": "_ga",
        "value": "Google LLC\n.nordkeyboards.com"
      },
      {
        "key": "_ga_S8Z6NRNNEV",
        "value": ".nordkeyboards.com"
      },
      {
        "key": "Name",
        "value": "Provider / Domain"
      },
      {
        "key": "VISITOR_INFO1_LIVE",
        "value": "Google LLC\n.youtube.com"
      },
      {
        "key": "YSC",
        "value": "Google LLC\n.youtube.com"
      },
      {
        "key": "Name",
        "value": "Provider / Domain"
      },
      {
        "key": "__Secure-ROLLOUT_TOKEN",
        "value": ".youtube.com"
      }
    ],
    "images": [
      {
        "url": "https://assets.nordkeyboards.com/nord-assets-prod/media/documents/DCBsGZq6/Nord%20Piano%206%20logo.svg",
        "alt_text": ""
      },
      {
        "url": "https://www.nordkeyboards.com/_next/image/?url=https%3A%2F%2Fassets.nordkeyboards.com%2Fnord-assets-prod%2Fmedia%2Foriginal_images%2FRkIccHIA%2FNord%2520-%2520NP6%2520-%2520Top%252088%2520-%2520250116%2520-%2520crop.jpg&w=1920&q=75",
        "alt_text": "Nord - NP6 - Top 88 - 250113 - crop"
      },
      {
        "url": "https://assets.nordkeyboards.com/nord-assets-prod/media/images/U5q0hJBR/Nord%20-%20NP6%20-%20Program%20Panel.width-800.jpg",
        "alt_text": "Nord Piano 6 Program panel"
      },
      {
        "url": "https://assets.nordkeyboards.com/nord-assets-prod/media/images/bRd257mB/NP6%20Piano-1.width-800.jpg",
        "alt_text": "NP6 Piano-1"
      },
      {
        "url": "https://assets.nordkeyboards.com/nord-assets-prod/media/images/icH96OG4/NP6%20Piano%23.width-800.jpg",
        "alt_text": "NP6 Piano#"
      },
      {
        "url": "https://assets.nordkeyboards.com/nord-assets-prod/media/images/9P2irFNP/NP6%20Effects.width-800.jpg",
        "alt_text": "NP6 Effects"
      }
    ],
    "videos": [],
    "features": [
      "Accessories",
      "Distributors",
      "Nord Electro 7",
      "Nord Stage 4",
      "Nord Piano 6",
      "Nord Organ 3",
      "Nord Grand 2",
      "Nord Electro 6",
      "Nord Wave 2",
      "Nord Lead A1",
      "Nord Drum 3P",
      "Legacy products",
      "Compare Products",
      "ProductsMinusAll ProductsNord Electro 7Nord Stage 4Nord Piano 6Nord Organ 3Nord Grand 2Nord Electro 6Nord Wave 2Nord Lead A1Nord Drum 3PLegacy productsCompare Products",
      "All Products",
      "Nord Electro 7",
      "Nord Stage 4",
      "Nord Piano 6",
      "Nord Organ 3",
      "Nord Grand 2",
      "Nord Electro 6",
      "Nord Wave 2"
    ],
    "manuals": [],
    "support_url": "https://www.nordkeyboards.com/products/nord-piano-6/",
    "hierarchy": {},
    "metadata": {
      "raw_capture": true
    }
  }
}