{
  "metadata": {
    "scraped_at": "2026-01-25T22:14:56.676534",
    "source_url": "https://www.nordkeyboards.com/products/nord-electro-6/",
    "brand": "Nord",
    "model": "Nord Electro 6"
  },
  "raw_payload": {
    "source_url": "https://www.nordkeyboards.com/products/nord-electro-6/",
    "brand": "Nord",
    "model": "Nord Electro 6",
    "name": "Nord Electro 6",
    "description": "Products\nAccessories\nSounds\nSoftware\nDownloads\nArtists\nAbout us\nNews\nSupport\nDistributors\nALL PRODUCTS\nNord Electro 7\nNord Stage 4\nNord Piano 6\nNord Organ 3\nNord Grand 2\nNord Electro 6\nNord Wave 2\nNord Lead A1\nNord Drum 3P\nLegacy products\nCompare Products\nNord Electro 6\n\nThe Nord Electro 6 combines our award-winning emulations of vintage electro mechanical and acoustic instruments in an ultra-portable package. With 3 independent sound sections, a new streamlined user interface and the addition of Seamless Transitions, we're proud to present the most powerful and flexible Electro ever - a refined modern classic.\n\nModels\n\nNord Electro 6D 73\nNord Electro 6D 61\nNord Electro 6 HP\n\n73-note Semi-Weighted Waterfall keybed\n\nOverview\nSpecifications\nSounds\nDownloads\nImages & videos\nAccessories\nHighlight features\n\nGeneral\n\nSeamless Transitions\n3 part multi-timbral\nSplit and Layer all 3 sections with optional Split Point Crossfades\nOLED Display for excellent overview\nOrganize Mode for quickly rearranging programs, sounds and pages\n\nPiano Section\n\nPiano Filters\nGreatly expanded polyphony\nSympathetic String Resonance\n4 Dynamic Curves\n\nSample Synth\n\nExpanded memory for Nord Sample Library\nExtended Voice Polyphony\nDedicated Sample Synth section with Attack, Decay/Release and dynamic controls\n\nOrgan\n\nB3 Tonewheel, B3 Bass, Vox and Farfisa simulations\n2 Pipe Organ models\nDual Organ Mode\nModel 122 Vintage Rotary Speaker\nPhysical Drawbars on 6D 61 and 6D 73 models\nMount for Half-Moon Switch for Rotary Speaker control (6D 61/73)\n\nEffects\n\nA wide range of instantly tweakable high quality stereo effects modelled after classic stomp boxes\nReverb with Bright Mode\n\n*All specifications subject to change without further notice\n\nPerformance\n\nThe new streamlined Program section features a handy Organize mode including Copy/Paste and Move functionality for quickly arranging your Programs to your desired order. A new Page View lets you easily sort and organize pages as a song list.\n\nAll Programs, Pianos and Synth Samples are easily navigated using the new List View that offers alphabetical, numerical and category sorting options.\n\nLayer and advanced Split functionality\n\nThe panel has three independent sound sections; Organ, Piano and Sample Synth that can be used simultaneously as a layer or a split. It features 6 Split Points and the new Split Point Crossfade functionality introduced with the Stage 3 for smooth transitions between two split zones. Choose from 3 different crossfade widths (Small, Large or Off) as indicated by different LED colors.\n\nSeamless transitions\n\nThe Nord Electro 6 features automatically seamless transitions when changing sounds or programs while playing.\n\nOrgan Section\n\nThe Nord Electro 6 features our award-winning Nord C2D Organ simulations of B3 Tonewheel, B3 Bass and Vintage Transistor Organs plus two Pipe Organ models. \n\nB3 Tonewheel simulation\n\nThe Organ section features our acclaimed Nord C2D Organ engine including the extremely authentic B3 Tonewheel simulation with four different tone wheel settings, ranging from factory new clean to leaky old vintage.\n\nAn improved dedicated Bass mode simulating the Pedal Bass Tonewheels are available for either splitting with a Piano or Synth or with a B3 Upper Manual in Dual Organ Mode.\n\nClassic Transistor Organs\n\nOur impeccable simulations of the classic 1960’s Transistor Organs, Vox Continental and Farfisa Compact with all the classic settings, are also included in the Organ section.\n\nPipe Organs\n\nThe Organ section now contains two different Pipe Organ models. The new Pipe 1 is a pure Organ with few harmonics. The Pipe 2, introduced with the Electro 5, is a recreation of metal pipes that commonly make up the backbone of a pipe or church organ, and now includes a special new detune mode when enabling Vibrato/Chorus.\n\nVintage Rotary Speaker\n\nThe Nord Electro 6 has the latest generation of our vintage 122 Rotary Speaker simulation adding an essential character to a live organ performance and features Slow, Fast and Stop mode as well as a Drive control. The Electro 6D 61 and 73 support the Nord Half-moon Switch (optional accessory).\n\nDual Organ Mode\n\nThe dedicated new Dual Organ mode provides quick access to dual manual setups and offers great overview and control of the drawbar settings for both the Lower and Upper manual.\n\nPhysical Drawbars for Electro 6D 61/73\n\nThe Electro 6D 61 and 73 feature Physical Drawbars offering ultimate hands-on experience for the dedicated organ players. The Electro 6 HP features Digital LED Drawbars, offering excellent overview over current settings.\n\nPiano Section\n\nThe Piano section has a wide selection of acoustic, electric and digital pianos from the exclusive Nord Piano Library, extended voice polyphony and creative new Piano Filters.\n\nFactory Bank\n\nThe Nord Electro 6 factory bank contains an extensive selection of our latest Grands, Uprights, Electric Pianos and Digital Pianos from the exclusive Nord Piano Library - all handpicked for their unique characters! The Piano section also features our new “Layer” category with rich dynamic layered patches.\n\nThe Nord Piano Experience\n\nNord’s state-of-the-art sampling techniques capture the extraordinary nuances and real character of the source instruments and unique ‘Advanced String Resonance’ delivers breathtaking realism and an unsurpassed level of expressiveness.\n\nReplaceable sounds\n\nThe Factory Bank features a great selection from the Nord Piano Library but you can easily add or replace any of these sounds using the Nord Sound Manager. Our exclusive Nord Piano Library is constantly updated with new exclusive world class sounds, and always free of charge.\n\nPiano Filters\n\nProviding an additional level of sonic control, the Piano Section now features dedicated piano filters for accentuating softness, mid or brilliance.\n\nSoft Release\n\nA Soft Release-mode adds a slightly longer release, more suitable for legato playing, emulating a looser damper tension in an acoustic or an electromechanical instrument.\n\nDynamic Curves\n\n4 dynamic curves are available to suit your playing style, from soft to hard.\n\nSample Synth Section\n\nThe enhanced Sample Synth Section features expanded memory for the Nord Sample Library 3.0 and extended polyphony.\n\nThe Sample Synth Section contains a broad selection of high quality sounds from the Nord Sample Library 3.0 including the exclusively licensed sounds of the legendary Mellotron and Chamberlin.\n\nThe Sample Synth is equipped with essential controls for attack, decay/release and dynamics (filter/velocity). A unique Nord feature allows you to create your own samples using the free Nord Sample Editor software for WIndows and Mac.\n\nAll samples can be replaced using the Nord Sound Manager application\nThe Sample Synth section comes shipped with an extensive selection of one hundred samples from the Nord Sample Library\nAttack and Decay/Release control\n4 levels of dynamic velocity control\nVelocity sensitive low pass filter\n46 voice polyphony for Sample Library sounds.\nEffect Section\n\nThe powerful Effect section features a wide range of instantly tweakable high quality effects modelled after classic stomp boxes. All effects are stereo and can be assigned freely to the Organ, Piano or Synth sections.\n\nEffect 1\n\nHere you can choose from Tremolo, two Wahs, an Auto-Wah, and an AutoPan. Use the AutoWah with a Clavinet for raw funk licks, create a psychedelic vibe with an Electric Piano on AutoPan, or give a Wurlitzer some body using the Tremolo. There is also a Ring Modulator on board, an effect used by many experimental and electronic musicians.\n\nEffect 2\n\nThe two Phasers, two Choruses, the Flanger and a Vibe effect are modeled from the classic analog stomp boxes that define the sound of popular music.\n\nAmp Sim/Compressor/Rotary\n\nFeatures authentic JC, Twin and Small speaker simulations with adjustable Drive, plus a separate Tube Drive simulation and a Compressor.\n\nEQ\n\nA 3-band Equalizer with sweepable mid.\n\nDelay\n\nThe Delay effect features a Tap Tempo, Feedback and Mix (Dry/Wet), as well as controls for Ping-Pong mode and Tap Tempo.\n\nReverb\n\nThe Nord Electro 6 has three different Reverb types (Hall, Stage and Room) for adding some ambience to your sounds. All Reverb types also has a Bright mode.\n\nProducts\nSounds\nDownloads\nSoftware\nArtists\nAbout Us\nDistributors\nSupport\nNews\nNewsletter\nYouTube\nInstagram\nTwitter\nFacebook\nCookie settings\n\nCopyright © 2025 Clavia DMI AB. All rights reserved.\n\n×\nThis website uses cookies\nThis website uses cookies to improve user experience. By using our website you consent to all cookies in accordance with our Cookie Policy.\nRead more\nStrictly necessary\nPerformance\nTargeting\nUnclassified\nShow details\nAccept all\nDecline all\nCookie declaration\nAbout cookies\nStrictly necessary\nPerformance\nTargeting\nUnclassified\nStrictly necessary cookies allow core website functionality such as user login and account management. The website cannot be used properly without strictly necessary cookies.\nName\tProvider / Domain\tExpiration\tDescription\ncsrftoken\twww.nordkeyboards.com\t1 month\tThis cookie is associated with the Django web development platform for Python. It is designed to protect a website against a certain type of software attack on web forms.\nproductTooltip\twww.nordkeyboards.com\t7 days\tThis cookie remembers whether the user has closed the tooltip that describes the product chooser.\nCookieScriptConsent\t\nCookieScript\nwww.nordkeyboards.com\t1 month\tThis cookie is used by Cookie-Script.com service to remember visitor cookie consent preferences. It is necessary for Cookie-Script.com cookie banner to work properly.\nVISITOR_PRIVACY_METADATA\t\nYouTube\n.youtube.com\t6 months\tThis cookie is used to store the user's consent and privacy choices for their interaction with the site. It records data on the visitor's consent regarding various privacy policies and settings, ensuring that their preferences are honored in future sessions.\n__cflb\t\nCloudflare, Inc.\napi2.hcaptcha.com\t30 minutes\tThis cookie is used for load balancing and for identifying trusted web traffic. It helps in ensuring consistent service and user experience by managing traffic and routing users to specific servers.\nPerformance cookies are used to see how visitors use the website, eg. analytics cookies. Those cookies cannot be used to directly identify a certain visitor.\nName\tProvider / Domain\tExpiration\tDescription\n_ga_GL2X1VT0CK\t.nordkeyboards.com\t1 year\tThis cookie is used by Google Analytics to persist session state.\n_ga\t\nGoogle LLC\n.nordkeyboards.com\t1 year 1 month\tThis cookie name is associated with Google Universal Analytics - which is a significant update to Google's more commonly used analytics service. This cookie is used to distinguish unique users by assigning a randomly generated number as a client identifier. It is included in each page request in a site and used to calculate visitor, session and campaign data for the sites analytics reports.\n_ga_S8Z6NRNNEV\t.nordkeyboards.com\t1 year 1 month\tThis cookie is used by Google Analytics to persist session state.\nTargeting cookies are used to identify visitors between different websites, eg. content partners, banner networks. Those cookies may be used by companies to build a profile of visitor interests or show relevant ads on other websites.\nName\tProvider / Domain\tExpiration\tDescription\nVISITOR_INFO1_LIVE\t\nGoogle LLC\n.youtube.com\t6 months\tThis cookie is set by Youtube to keep track of user preferences for Youtube videos embedded in sites;it can also determine whether the website visitor is using the new or old version of the Youtube interface.\nYSC\t\nGoogle LLC\n.youtube.com\tSession\tThis cookie is set by YouTube to track views of embedded videos.\nUnclassified cookies are cookies that do not belong to any other category or are in the process of categorization.\nName\tProvider / Domain\tExpiration\tDescription\n__Secure-ROLLOUT_TOKEN\t.youtube.com\t6 months\t\nCookies are small text files that are placed on your computer by websites that you visit. Websites use cookies to help users navigate efficiently and perform certain functions. Cookies that are required for the website to operate properly are allowed to be set without your permission. All other cookies need to be approved before they can be set in the browser.\n\nYou can change your consent to cookie usage at any time on our Privacy Policy page.\nCookie report created by CookieScript",
    "specifications": [
      {
        "key": "Name",
        "value": "Provider / Domain"
      },
      {
        "key": "csrftoken",
        "value": "www.nordkeyboards.com"
      },
      {
        "key": "productTooltip",
        "value": "www.nordkeyboards.com"
      },
      {
        "key": "CookieScriptConsent",
        "value": "CookieScript\nwww.nordkeyboards.com"
      },
      {
        "key": "VISITOR_PRIVACY_METADATA",
        "value": "YouTube\n.youtube.com"
      },
      {
        "key": "__cflb",
        "value": "Cloudflare, Inc.\napi2.hcaptcha.com"
      },
      {
        "key": "Name",
        "value": "Provider / Domain"
      },
      {
        "key": "_ga_GL2X1VT0CK",
        "value": ".nordkeyboards.com"
      },
      {
        "key": "_ga",
        "value": "Google LLC\n.nordkeyboards.com"
      },
      {
        "key": "_ga_S8Z6NRNNEV",
        "value": ".nordkeyboards.com"
      },
      {
        "key": "Name",
        "value": "Provider / Domain"
      },
      {
        "key": "VISITOR_INFO1_LIVE",
        "value": "Google LLC\n.youtube.com"
      },
      {
        "key": "YSC",
        "value": "Google LLC\n.youtube.com"
      },
      {
        "key": "Name",
        "value": "Provider / Domain"
      },
      {
        "key": "__Secure-ROLLOUT_TOKEN",
        "value": ".youtube.com"
      }
    ],
    "images": [
      {
        "url": "https://assets.nordkeyboards.com/nord-assets-prod/media/documents/NE6_logo_Xheight.svg",
        "alt_text": ""
      },
      {
        "url": "https://www.nordkeyboards.com/_next/image/?url=https%3A%2F%2Fassets.nordkeyboards.com%2Fnord-assets-prod%2Fmedia%2Foriginal_images%2FNord_Electro6D_73_Large_60.jpg&w=1920&q=75",
        "alt_text": "models-electro6-73"
      },
      {
        "url": "https://www.nordkeyboards.com/_next/image/?url=https%3A%2F%2Fassets.nordkeyboards.com%2Fnord-assets-prod%2Fmedia%2Foriginal_images%2FElectro6-performance.jpg&w=1920&q=75",
        "alt_text": null
      },
      {
        "url": "https://www.nordkeyboards.com/_next/image/?url=https%3A%2F%2Fassets.nordkeyboards.com%2Fnord-assets-prod%2Fmedia%2Foriginal_images%2FNE6D-Organ-Section_1.jpg&w=1920&q=75",
        "alt_text": null
      },
      {
        "url": "https://www.nordkeyboards.com/_next/image/?url=https%3A%2F%2Fassets.nordkeyboards.com%2Fnord-assets-prod%2Fmedia%2Foriginal_images%2FNE6-Dual-Organ-Mode_2.jpg&w=1920&q=75",
        "alt_text": null
      },
      {
        "url": "https://www.nordkeyboards.com/_next/image/?url=https%3A%2F%2Fassets.nordkeyboards.com%2Fnord-assets-prod%2Fmedia%2Foriginal_images%2FElectro6_piano-section-angle.jpg&w=1920&q=75",
        "alt_text": null
      },
      {
        "url": "https://www.nordkeyboards.com/_next/image/?url=https%3A%2F%2Fassets.nordkeyboards.com%2Fnord-assets-prod%2Fmedia%2Foriginal_images%2FElectro6_synth-section.jpg&w=1920&q=75",
        "alt_text": null
      },
      {
        "url": "https://www.nordkeyboards.com/_next/image/?url=https%3A%2F%2Fassets.nordkeyboards.com%2Fnord-assets-prod%2Fmedia%2Foriginal_images%2FElectro6_img3.jpg&w=1920&q=75",
        "alt_text": null
      }
    ],
    "videos": [],
    "features": [
      "Accessories",
      "Distributors",
      "Nord Electro 7",
      "Nord Stage 4",
      "Nord Piano 6",
      "Nord Organ 3",
      "Nord Grand 2",
      "Nord Electro 6",
      "Nord Wave 2",
      "Nord Lead A1",
      "Nord Drum 3P",
      "Legacy products",
      "Compare Products",
      "ProductsMinusAll ProductsNord Electro 7Nord Stage 4Nord Piano 6Nord Organ 3Nord Grand 2Nord Electro 6Nord Wave 2Nord Lead A1Nord Drum 3PLegacy productsCompare Products",
      "All Products",
      "Nord Electro 7",
      "Nord Stage 4",
      "Nord Piano 6",
      "Nord Organ 3",
      "Nord Grand 2",
      "Nord Electro 6",
      "Nord Wave 2"
    ],
    "manuals": [],
    "support_url": "https://www.nordkeyboards.com/products/nord-electro-6/",
    "hierarchy": {},
    "metadata": {
      "raw_capture": true
    }
  }
}